[
  {
    "slug": "affordability-high",
    "rule": "destination has an affordability rating of 'A' or 'B'",
    "pro": "Fits your budget perfectly",
    "con": "May be above your target budget"
  },
  {
    "slug": "healthcare-cost-low",
    "rule": "destination has a healthcare cost rating of 'A' or 'B'",
    "pro": "Low healthcare costs",
    "con": "Higher medical expenses"
  },
  {
    "slug": "affordability-mid",
    "rule": "destination has an affordability rating of 'B' or 'C'",
    "pro": "Comfortable mid-range costs",
    "con": "Costs may vary from your target"
  },
  {
    "slug": "infrastructure-high",
    "rule": "destination has an infrastructure rating of 'A'",
    "pro": "First-world infrastructure",
    "con": "Developing infrastructure"
  },
  {
    "slug": "grade-high",
    "rule": "destination has a grade of 'A' or 'B'",
    "pro": "Top-tier quality of life",
    "con": "Modest quality of life"
  },
  {
    "slug": "climate-tropical",
    "rule": "destination has a climate of 'Tropical' or 'Subtropical'",
    "pro": "Beautiful tropical weather",
    "con": "Not a tropical climate"
  },
  {
    "slug": "tag-beach-living",
    "rule": "destination has the tag 'Beach Living'",
    "pro": "Stunning coastal lifestyle",
    "con": "Away from the coast"
  },
  {
    "slug": "climate-mediterranean",
    "rule": "destination has a climate of 'Mediterranean'",
    "pro": "Pleasant Mediterranean climate",
    "con": "Not a Mediterranean climate"
  },
  {
    "slug": "tag-warm-weather",
    "rule": "destination has the tag 'Warm Weather'",
    "pro": "Sunny and warm year-round",
    "con": "Varying temperatures"
  },
  {
    "slug": "climate-temperate",
    "rule": "destination has a climate of 'Temperate'",
    "pro": "Clear seasonal changes",
    "con": "No distinct four seasons"
  },
  {
    "slug": "climate-cold",
    "rule": "destination has a climate of 'Cold'",
    "pro": "Crisp, cool mountain air",
    "con": "Warmer climate"
  },
  {
    "slug": "tag-mountain-living",
    "rule": "destination has the tag 'Mountain Living'",
    "pro": "Beautiful mountain scenery",
    "con": "Flat or coastal terrain"
  },
  {
    "slug": "healthcare-quality-high",
    "rule": "destination has a healthcare quality rating of 'A'",
    "pro": "World-class medical facilities",
    "con": "Basic healthcare facilities"
  },
  {
    "slug": "pro-healthcare-access",
    "rule": "destination has the pro 'strong-healthcare-access'",
    "pro": "Easy access to specialists",
    "con": "Limited medical access"
  },
  {
    "slug": "healthcare-quality-good",
    "rule": "destination has a healthcare quality rating of 'A' or 'B'",
    "pro": "Reliable medical care",
    "con": "Varying healthcare standards"
  },
  {
    "slug": "pro-improving-healthcare",
    "rule": "destination has the pro 'improving-healthcare'",
    "pro": "Rapidly modernizing healthcare",
    "con": "Traditional healthcare systems"
  },
  {
    "slug": "safety-quality-high",
    "rule": "destination has a personal safety rating of 'A'",
    "pro": "Exceptional personal safety",
    "con": "Standard safety environment"
  },
  {
    "slug": "safety-quality-good",
    "rule": "destination has a personal safety rating of 'A' or 'B'",
    "pro": "Very safe and secure",
    "con": "Higher safety precautions required"
  },
  {
    "slug": "english-widely-spoken",
    "rule": "destination has an english usage of 'Widely Spoken'",
    "pro": "English is widely spoken",
    "con": "English is not common"
  },
  {
    "slug": "pro-english-friendly",
    "rule": "destination has the pro 'english-friendly'",
    "pro": "Very easy for English speakers",
    "con": "Local language skills required"
  },
  {
    "slug": "english-commonly-used",
    "rule": "destination has an english usage of 'Commonly Used'",
    "pro": "Common English in expat areas",
    "con": "Limited English usage"
  },
  {
    "slug": "community-thriving",
    "rule": "destination has a retirement community of 'Thriving Hub'",
    "pro": "Vibrant international community",
    "con": "Small expat presence"
  },
  {
    "slug": "pro-expat-community",
    "rule": "destination has the pro 'strong-expat-community'",
    "pro": "Thriving social scene",
    "con": "Isolated social environment"
  },
  {
    "slug": "community-established",
    "rule": "destination has a retirement community of 'Established'",
    "pro": "Well-balanced expat scene",
    "con": "Emerging expat scene"
  },
  {
    "slug": "crowds-tranquil",
    "rule": "destination has crowds of 'Tranquil'",
    "pro": "Peaceful and quiet",
    "con": "Lively and bustling"
  },
  {
    "slug": "pro-low-crowds",
    "rule": "destination has the pro 'low-crowds'",
    "pro": "Low crowds and no traffic",
    "con": "Can be crowded in peaks"
  },
  {
    "slug": "visa-ease-high",
    "rule": "destination has a visa ease rating of 'A' or 'B'",
    "pro": "Straightforward residency",
    "con": "Complex visa process"
  },
  {
    "slug": "pro-easy-visa-access",
    "rule": "destination has the pro 'easy-visa-access'",
    "pro": "Simple retirement visa path",
    "con": "Stricter residency rules"
  },
  {
    "slug": "region-americas",
    "rule": "destination is in the Americas",
    "pro": "Located in the Americas",
    "con": "Not in the Americas"
  },
  {
    "slug": "region-europe",
    "rule": "destination is in Europe",
    "pro": "Located in Europe",
    "con": "Not in Europe"
  },
  {
    "slug": "region-asia",
    "rule": "destination is in Asia",
    "pro": "Located in Asia",
    "con": "Not in Asia"
  },
  {
    "slug": "region-mena",
    "rule": "destination is in Middle East & North Africa",
    "pro": "Located in Middle East & North Africa",
    "con": "Not in Middle East & North Africa"
  },
  {
    "slug": "region-oceania",
    "rule": "destination is in Oceania",
    "pro": "Located in Oceania",
    "con": "Not in Oceania"
  }
]
